{"executedAt":"2026-08-11T15:21:09Z","failure":null,"orderedRecords":[{"recordByteSha256":"ef16882558ec5c1e49beed8d2bb86a0e29e380fc84a63ac7e842de94d78897d2","recordId":"10334c0464e88fb9b174ddc118eaac45650623d64d40bb13fbf15691b96e4d3a","scope":{"capability":"demand_forecast_non_pit","environment":"local","retailerId":"retailer-demo","tenantId":"tenant-demo"}},{"recordByteSha256":"caffb5bd88b693b2e6d4b99a64f7c12689590955e6b18133a1a55f4b66a61643","recordId":"ec4b9228eced74c86ccbf585b7982ef43fd4064776f483df0dc7d34c8d3e2682","scope":{"capability":"inventory_replenishment_current_snapshot","environment":"local","retailerId":"retailer-demo","tenantId":"tenant-demo"}},{"recordByteSha256":"961969467667c9cd56f3b763f998ce0c767f4c37773a716b82b7ce1d010bf57c","recordId":"9d0e9fd60d132d8db3e5b353f1db67eaedd418336bc1e753daf348ef5b373ddd","scope":{"capability":"inventory_replenishment_replay","environment":"local","retailerId":"retailer-demo","tenantId":"tenant-demo"}}],"outcome":"adopted","pointerAfter":{"byteSha256":"a7650a7153f2d71e143db0ddc4392a5b0ceca6bec1d3f5df55b0b11b58a5ad15","state":"present"},"pointerBefore":{"state":"absent"},"receiptId":"019ff169-c968-7f4e-a33c-d28916657219","recovery":{"journalId":null,"recovered":false},"schemaVersion":"retail-capability-entry-receipt/v1"}