{"executedAt":"2026-08-11T15:21:30Z","failure":null,"orderedRecords":[{"recordByteSha256":"b5a5dd286383c27126a7aec13d92e15e84564ce51aa1151fb6b53ac797ec377f","recordId":"623918ac3e6053fdfa0ab06765b71fb05e2a571a4b6d848b4231300a1d9af2e9","scope":{"capability":"demand_forecast_non_pit","environment":"local","retailerId":"retailer-demo","tenantId":"tenant-demo"}},{"recordByteSha256":"66fd121b655d418ab59fb7290f76b14e70932d552b11749d9e2a00cd904359b9","recordId":"3ee56556d3c91622100106150d87c95f48658a3039921d02281bccfd2743fd60","scope":{"capability":"inventory_replenishment_current_snapshot","environment":"local","retailerId":"retailer-demo","tenantId":"tenant-demo"}},{"recordByteSha256":"d3623fd84a84629060d349aab5822f068f1a10c60b934d21fb00b1891b16cdb6","recordId":"851fc6ab49ad6a3f34f348cae36985f39ddfa993ca2e9816086e18090f7c5891","scope":{"capability":"inventory_replenishment_replay","environment":"local","retailerId":"retailer-demo","tenantId":"tenant-demo"}}],"outcome":"adopted","pointerAfter":{"byteSha256":"8f83c28e0056dc0914a3da3e3b545477e071f83bb523292caa555389ec011fad","state":"present"},"pointerBefore":{"byteSha256":"a7650a7153f2d71e143db0ddc4392a5b0ceca6bec1d3f5df55b0b11b58a5ad15","state":"present"},"receiptId":"019ff16a-1ac1-7ded-b3ea-093eef64cba2","recovery":{"journalId":null,"recovered":false},"schemaVersion":"retail-capability-entry-receipt/v1"}